{
 "schema_version": 1,
 "generated_at": "2026-10-24T05:42:35Z",
 "sec_data_date": "2026-10-02",
 "firms": [
  {
   "slug": "acore-capital-175054",
   "name": "Acore Capital",
   "legal_name": "Acore Capital",
   "crd": "175054",
   "city": "New York",
   "state": "NY",
   "sec_aum_usd": 18271945621.0,
   "story_count": 1
  },
  {
   "slug": "advantage-capital-171365",
   "name": "Advantage Capital",
   "legal_name": "Advantage Capital Investment Adviser",
   "crd": "171365",
   "city": "New Orleans",
   "state": "LA",
   "sec_aum_usd": 1294679102.0,
   "story_count": 1
  },
  {
   "slug": "aldrich-wealth-147200",
   "name": "Aldrich Wealth",
   "legal_name": "Aldrich Wealth, Limited Partnership",
   "crd": "147200",
   "city": "Lake Oswego",
   "state": "OR",
   "sec_aum_usd": 7615331850.0,
   "story_count": 1
  },
  {
   "slug": "alliant-securities-inc-turner-nord-kienbaum-7726",
   "name": "Alliant Securities, Inc. Turner, Nord, Kienbaum",
   "legal_name": "Alliant Securities",
   "crd": "7726",
   "city": "Liberty Lake",
   "state": "WA",
   "sec_aum_usd": 300000000.0,
   "story_count": 1
  },
  {
   "slug": "alphacore-capital-174346",
   "name": "Alphacore Capital",
   "legal_name": "Alphacore Capital",
   "crd": "174346",
   "city": "La Jolla",
   "state": "CA",
   "sec_aum_usd": 12959408390.0,
   "story_count": 1
  },
  {
   "slug": "altruist-299398",
   "name": "Altruist",
   "legal_name": "Altruist",
   "crd": "299398",
   "city": "Culver City",
   "state": "CA",
   "sec_aum_usd": 0.0,
   "story_count": 1
  },
  {
   "slug": "american-industrial-partners-156878",
   "name": "American Industrial Partners",
   "legal_name": "Aip",
   "crd": "156878",
   "city": "New York",
   "state": "NY",
   "sec_aum_usd": 17473970965.0,
   "story_count": 1
  },
  {
   "slug": "apella-wealth-171106",
   "name": "Apella Wealth",
   "legal_name": "Apella Capital",
   "crd": "171106",
   "city": "West Hartford",
   "state": "CT",
   "sec_aum_usd": 11065217421.0,
   "story_count": 1
  },
  {
   "slug": "ares-management-130074",
   "name": "Ares Management",
   "legal_name": "Ares Management",
   "crd": "130074",
   "city": "Los Angeles",
   "state": "CA",
   "sec_aum_usd": 458821489418.0,
   "story_count": 1
  },
  {
   "slug": "bain-capital-private-equity-145653",
   "name": "Bain Capital Private Equity",
   "legal_name": "Bain Capital Private Equity",
   "crd": "145653",
   "city": "Boston",
   "state": "MA",
   "sec_aum_usd": 96429353000.0,
   "story_count": 1
  },
  {
   "slug": "banner-capital-management-326949",
   "name": "Banner Capital Management",
   "legal_name": "Banner Capital Management",
   "crd": "326949",
   "city": "Lehi",
   "state": "UT",
   "sec_aum_usd": 619188611.0,
   "story_count": 1
  },
  {
   "slug": "blue-rock-financial-group-298558",
   "name": "Blue Rock Financial Group",
   "legal_name": "Dravo Bay",
   "crd": "298558",
   "city": "Rehoboth Beach",
   "state": "DE",
   "sec_aum_usd": 381821487.0,
   "story_count": 1
  },
  {
   "slug": "bluespring-wealth-management-152667",
   "name": "Bluespring Wealth Management",
   "legal_name": "Bluespring Wealth Management",
   "crd": "152667",
   "city": "Austin",
   "state": "TX",
   "sec_aum_usd": 5430907207.0,
   "story_count": 1
  },
  {
   "slug": "brightstar-capital-partners-283313",
   "name": "Brightstar Capital Partners",
   "legal_name": "Brightstar Capital Partners",
   "crd": "283313",
   "city": "New York",
   "state": "NY",
   "sec_aum_usd": 4849984324.0,
   "story_count": 1
  },
  {
   "slug": "cais-advisors-317466",
   "name": "Cais Advisors",
   "legal_name": "Cais Advisors",
   "crd": "317466",
   "city": "New York",
   "state": "NY",
   "sec_aum_usd": 225327313.0,
   "story_count": 1
  },
  {
   "slug": "captrust-175112",
   "name": "Captrust",
   "legal_name": "Capfinancial Partners",
   "crd": "175112",
   "city": "Raleigh",
   "state": "NC",
   "sec_aum_usd": 1236704853633.0,
   "story_count": 2
  },
  {
   "slug": "carlyle-group-111128",
   "name": "Carlyle Group",
   "legal_name": "Carlyle Investment Management",
   "crd": "111128",
   "city": "Washington",
   "state": "DC",
   "sec_aum_usd": 283814531141.0,
   "story_count": 1
  },
  {
   "slug": "carson-group-investing-291744",
   "name": "Carson Group Investing",
   "legal_name": "Carson Group Investing",
   "crd": "291744",
   "city": "Omaha",
   "state": "NE",
   "sec_aum_usd": 2048522707.0,
   "story_count": 1
  },
  {
   "slug": "cbre-investment-management-109981",
   "name": "Cbre Investment Management",
   "legal_name": "Cbre Investment Management",
   "crd": "109981",
   "city": "New York",
   "state": "NY",
   "sec_aum_usd": 22840880000.0,
   "story_count": 1
  },
  {
   "slug": "centrus-financial-strategies-339651",
   "name": "Centrus Financial Strategies",
   "legal_name": "Wilson Group Financial Management",
   "crd": "339651",
   "city": "Orlando",
   "state": "FL",
   "sec_aum_usd": 125094769.0,
   "story_count": 1
  },
  {
   "slug": "cerity-partners-151559",
   "name": "Cerity Partners",
   "legal_name": "Cerity Partners",
   "crd": "151559",
   "city": "New York",
   "state": "NY",
   "sec_aum_usd": 161675524141.0,
   "story_count": 2
  },
  {
   "slug": "charles-schwab-5393",
   "name": "Charles Schwab",
   "legal_name": "Charles Schwab",
   "crd": "5393",
   "city": "San Francisco",
   "state": "CA",
   "sec_aum_usd": 0.0,
   "story_count": 1
  },
  {
   "slug": "compass-advisors-288256",
   "name": "Compass Advisors",
   "legal_name": "Compass Advisory Group",
   "crd": "288256",
   "city": "Melville",
   "state": "NY",
   "sec_aum_usd": 767495362.0,
   "story_count": 1
  },
  {
   "slug": "compass-wealth-282420",
   "name": "Compass Wealth",
   "legal_name": "Compass Retirement Group",
   "crd": "282420",
   "city": "St. Louis",
   "state": "MO",
   "sec_aum_usd": 111859803.0,
   "story_count": 1
  },
  {
   "slug": "concurrent-investment-advisors-323135",
   "name": "Concurrent Investment Advisors",
   "legal_name": "Concurrent Investment Advisors",
   "crd": "323135",
   "city": "Tampa",
   "state": "FL",
   "sec_aum_usd": 15727990844.0,
   "story_count": 1
  },
  {
   "slug": "corient-319448",
   "name": "Corient",
   "legal_name": "Corient Private Wealth",
   "crd": "319448",
   "city": "Miami",
   "state": "FL",
   "sec_aum_usd": 165252436553.0,
   "story_count": 1
  },
  {
   "slug": "cornerstone-capital-105396",
   "name": "Cornerstone Capital",
   "legal_name": "Cornerstone Capital",
   "crd": "105396",
   "city": "Palo Alto",
   "state": "CA",
   "sec_aum_usd": 1357670355.0,
   "story_count": 1
  },
  {
   "slug": "cullen-investment-group-18266",
   "name": "Cullen Investment Group",
   "legal_name": "Cullen Investment Group",
   "crd": "18266",
   "city": "Lafayette",
   "state": "LA",
   "sec_aum_usd": 909951360.0,
   "story_count": 1
  },
  {
   "slug": "d-e-shaw-108679",
   "name": "D. E. Shaw",
   "legal_name": "D. E. Shaw",
   "crd": "108679",
   "city": "New York",
   "state": "NY",
   "sec_aum_usd": 213364737381.0,
   "story_count": 1
  },
  {
   "slug": "east-coast-asset-management-147910",
   "name": "East Coast Asset Management",
   "legal_name": "East Coast Asset Management",
   "crd": "147910",
   "city": "Essex",
   "state": "MA",
   "sec_aum_usd": 1006114321.0,
   "story_count": 1
  },
  {
   "slug": "echo-wealth-management-174136",
   "name": "Echo Wealth Management",
   "legal_name": "Echo Wealth Management",
   "crd": "174136",
   "city": "Plymouth",
   "state": "MN",
   "sec_aum_usd": 288189706.0,
   "story_count": 1
  },
  {
   "slug": "elliott-investment-management-307151",
   "name": "Elliott Investment Management",
   "legal_name": "Elliott Investment Management",
   "crd": "307151",
   "city": "West Palm Beach",
   "state": "FL",
   "sec_aum_usd": 128623830745.0,
   "story_count": 1
  },
  {
   "slug": "envestnet-pmc-111694",
   "name": "Envestnet PMC",
   "legal_name": "Envestnet Asset Management",
   "crd": "111694",
   "city": "Berwyn",
   "state": "PA",
   "sec_aum_usd": 614933249744.0,
   "story_count": 1
  },
  {
   "slug": "eqt-partners-160179",
   "name": "EQT Partners",
   "legal_name": "EQT Partners",
   "crd": "160179",
   "city": "New York",
   "state": "NY",
   "sec_aum_usd": 39196925743.0,
   "story_count": 2
  },
  {
   "slug": "forge-global-advisors-284722",
   "name": "Forge Global Advisors",
   "legal_name": "Forge Global Advisors",
   "crd": "284722",
   "city": "San Francisco",
   "state": "CA",
   "sec_aum_usd": 2458638402.0,
   "story_count": 1
  },
  {
   "slug": "forward-consumer-partners-327847",
   "name": "Forward Consumer Partners",
   "legal_name": "Forward Consumer Partners",
   "crd": "327847",
   "city": "Greenwich",
   "state": "CT",
   "sec_aum_usd": 425000000.0,
   "story_count": 1
  },
  {
   "slug": "frazier-healthcare-partners-157324",
   "name": "Frazier Healthcare Partners",
   "legal_name": "Frazier Management",
   "crd": "157324",
   "city": "Seattle",
   "state": "WA",
   "sec_aum_usd": 7718663169.0,
   "story_count": 1
  },
  {
   "slug": "gallagher-fiduciary-advisors-146509",
   "name": "Gallagher Fiduciary Advisors",
   "legal_name": "Gallagher Fiduciary Advisors",
   "crd": "146509",
   "city": "Rolling Meadows",
   "state": "IL",
   "sec_aum_usd": 194823102725.0,
   "story_count": 1
  },
  {
   "slug": "gemspring-capital-management-285081",
   "name": "Gemspring Capital Management",
   "legal_name": "Gemspring Capital Management",
   "crd": "285081",
   "city": "Westport",
   "state": "CT",
   "sec_aum_usd": 5140364797.0,
   "story_count": 1
  },
  {
   "slug": "general-catalyst-162548",
   "name": "General Catalyst",
   "legal_name": "General Catalyst Group Management",
   "crd": "162548",
   "city": "Cambridge",
   "state": "MA",
   "sec_aum_usd": 45502659880.0,
   "story_count": 1
  },
  {
   "slug": "gilead-capital-282023",
   "name": "Gilead Capital",
   "legal_name": "Gilead Capital",
   "crd": "282023",
   "city": "New York",
   "state": "NY",